{
  "$schema": "http://json-schema.org/draft-07/schema#",
  "title": "Execution Receipt (v1 Experimental)",
  "description": "Experimental schema for execution receipts v1.0.0-draft and v1.1.0-draft.",
  "type": "object",
  "required": [
    "schema_version",
    "artifact",
    "manifest_hash",
    "policy_hash",
    "bundle_hash",
    "inputs_hash",
    "outputs_hash",
    "runtime_version_digest",
    "result_digest",
    "caps_requested",
    "caps_granted",
    "caps_used",
    "result",
    "runtime",
    "started_at",
    "finished_at",
    "timestamp_strategy",
    "receipt_hash"
  ],
  "additionalProperties": false,
  "properties": {
    "schema_version": {
      "type": "string",
      "enum": [
        "1.0.0-draft",
        "1.1.0-draft"
      ]
    },
    "artifact": {
      "type": "string",
      "pattern": "^sha256:[0-9a-f]{64}$"
    },
    "manifest_hash": {
      "type": "string",
      "pattern": "^sha256:[0-9a-f]{64}$"
    },
    "policy_hash": {
      "type": "string",
      "pattern": "^sha256:[0-9a-f]{64}$"
    },
    "bundle_hash": {
      "type": "string",
      "pattern": "^sha256:[0-9a-f]{64}$"
    },
    "inputs_hash": {
      "type": "string",
      "pattern": "^sha256:[0-9a-f]{64}$"
    },
    "outputs_hash": {
      "type": "string",
      "pattern": "^sha256:[0-9a-f]{64}$"
    },
    "runtime_version_digest": {
      "type": "string",
      "pattern": "^sha256:[0-9a-f]{64}$"
    },
    "result_digest": {
      "type": "string",
      "pattern": "^sha256:[0-9a-f]{64}$"
    },
    "caps_requested": {
      "type": "array",
      "items": {
        "type": "string",
        "minLength": 1
      }
    },
    "caps_granted": {
      "type": "array",
      "items": {
        "type": "string",
        "minLength": 1
      }
    },
    "caps_used": {
      "type": "array",
      "items": {
        "type": "string",
        "minLength": 1
      }
    },
    "contract_hash": {
      "type": "string",
      "pattern": "^sha256:[0-9a-f]{64}$"
    },
    "instructions_hash": {
      "type": "string",
      "pattern": "^sha256:[0-9a-f]{64}$"
    },
    "input_schema_hash": {
      "type": "string",
      "pattern": "^sha256:[0-9a-f]{64}$"
    },
    "output_schema_hash": {
      "type": "string",
      "pattern": "^sha256:[0-9a-f]{64}$"
    },
    "effects_used": {
      "type": "array",
      "items": {
        "type": "object",
        "required": [
          "kind",
          "selector",
          "calls",
          "bytes_in",
          "bytes_out",
          "denied_calls"
        ],
        "additionalProperties": false,
        "properties": {
          "kind": {
            "type": "string",
            "minLength": 1
          },
          "selector": {
            "type": "string",
            "minLength": 1
          },
          "calls": {
            "type": "integer",
            "minimum": 0
          },
          "bytes_in": {
            "type": "integer",
            "minimum": 0
          },
          "bytes_out": {
            "type": "integer",
            "minimum": 0
          },
          "denied_calls": {
            "type": "integer",
            "minimum": 0
          }
        }
      }
    },
    "result": {
      "type": "object",
      "required": [
        "status",
        "code"
      ],
      "additionalProperties": false,
      "properties": {
        "status": {
          "type": "string",
          "enum": [
            "success",
            "failure"
          ]
        },
        "code": {
          "type": "string",
          "minLength": 1
        },
        "message": {
          "type": "string"
        }
      }
    },
    "runtime": {
      "type": "object",
      "required": [
        "name",
        "version"
      ],
      "additionalProperties": false,
      "properties": {
        "name": {
          "type": "string",
          "minLength": 1
        },
        "version": {
          "type": "string",
          "minLength": 1
        },
        "profile": {
          "type": "string",
          "minLength": 1
        }
      }
    },
    "started_at": {
      "type": "integer",
      "minimum": 0
    },
    "finished_at": {
      "type": "integer",
      "minimum": 0
    },
    "timestamp_strategy": {
      "type": "string",
      "enum": [
        "local_untrusted_unix_seconds"
      ]
    },
    "attestations": {
      "type": "array",
      "items": {
        "type": "object",
        "required": [
          "type",
          "value"
        ],
        "additionalProperties": false,
        "properties": {
          "type": {
            "type": "string",
            "minLength": 1
          },
          "value": {
            "type": "string",
            "minLength": 1
          }
        }
      }
    },
    "receipt_hash": {
      "type": "string",
      "pattern": "^sha256:[0-9a-f]{64}$"
    }
  },
  "allOf": [
    {
      "if": {
        "properties": {
          "schema_version": {
            "const": "1.0.0-draft"
          }
        }
      },
      "then": {
        "not": {
          "anyOf": [
            {
              "required": [
                "contract_hash"
              ]
            },
            {
              "required": [
                "instructions_hash"
              ]
            },
            {
              "required": [
                "input_schema_hash"
              ]
            },
            {
              "required": [
                "output_schema_hash"
              ]
            },
            {
              "required": [
                "effects_used"
              ]
            }
          ]
        }
      }
    },
    {
      "if": {
        "properties": {
          "schema_version": {
            "const": "1.1.0-draft"
          }
        }
      },
      "then": {
        "required": [
          "contract_hash",
          "instructions_hash",
          "input_schema_hash",
          "output_schema_hash",
          "effects_used"
        ]
      }
    }
  ]
}
